{
    "$schema": "https://json-schema.org/draft/2020-12/schema",
    "title": "Service Pipeline Config",
    "description": "Configuration file controlling linting, testing, building, image tagging, and Kubernetes deployment for a service.",
    "type": "object",
    "properties": {
        "$schema": {
            "type": "string",
            "description": "Optional JSON Schema reference URI for tooling or validation."
        },
        "dependencies": {
            "type": "object",
            "description": "Configuration for installing dependencies.",
            "properties": {
                "enabled": {
                    "type": "boolean",
                    "description": "Whether dependencies should be installed for this service."
                },
                "command": {
                    "type": "string",
                    "description": "The command executed to install dependencies."
                }
            },
            "required": [
                "enabled",
                "command"
            ],
            "additionalProperties": false
        },
        "lint": {
            "type": "object",
            "description": "Configuration for linting and static analysis.",
            "properties": {
                "enabled": {
                    "type": "boolean",
                    "description": "Whether linting should run for this service."
                },
                "command": {
                    "type": "string",
                    "description": "The command executed to perform linting."
                }
            },
            "required": [
                "enabled",
                "command"
            ],
            "additionalProperties": false
        },
        "test": {
            "type": "object",
            "description": "Configuration for running unit or integration tests.",
            "properties": {
                "enabled": {
                    "type": "boolean",
                    "description": "Whether tests should run for this service."
                },
                "command": {
                    "type": "string",
                    "description": "The command executed to run tests."
                }
            },
            "required": [
                "enabled",
                "command"
            ],
            "additionalProperties": false
        },
        "build": {
            "type": "object",
            "description": "Configuration for building the service artifact.",
            "properties": {
                "enabled": {
                    "type": "boolean",
                    "description": "Whether the build step should run for this service."
                },
                "command": {
                    "type": "string",
                    "description": "The command executed to build the service."
                }
            },
            "required": [
                "enabled",
                "command"
            ],
            "additionalProperties": false
        },
        "image": {
            "type": "object",
            "description": "Configuration for building and tagging container images.",
            "properties": {
                "enabled": {
                    "type": "boolean",
                    "description": "Whether a container image should be built for this service."
                },
                "tagSeries": {
                    "type": "string",
                    "description": "The base tag or tag prefix used when generating image tags."
                },
                "repository": {
                    "type": "string",
                    "description": "The container registry repository where the built image will be pushed."
                },
                "context": {
                    "type": "string",
                    "description": "Optional build context directory, relative to the current working directory, used for the docker build command."
                },
                "dockerfile": {
                    "type": "string",
                    "description": "Optional path to the Dockerfile, relative to the current working directory, used for the docker build command."
                },
                "platform": {
                    "type": "object",
                    "description": "Platform configuration for single or multi-architecture builds.",
                    "properties": {
                        "single": {
                            "type": "boolean",
                            "description": "Whether to build a single-architecture image. When true, the build will automatically use the host machine's native CPU architecture."
                        },
                        "multi": {
                            "type": "array",
                            "description": "List of target platforms for multi-architecture builds. This list is ignored when 'single' is true.",
                            "items": {
                                "type": "string",
                                "enum": [
                                    "linux/amd64",
                                    "linux/arm64"
                                ]
                            }
                        }
                    },
                    "required": [
                        "single",
                        "multi"
                    ],
                    "additionalProperties": false
                }
            },
            "required": [
                "enabled",
                "tagSeries",
                "repository",
                "platform"
            ],
            "additionalProperties": false
        },
        "deploy": {
            "type": "object",
            "description": "Configuration for Kubernetes deployments.",
            "properties": {
                "enabled": {
                    "type": "boolean",
                    "description": "Whether the deploy stage should run."
                },
                "name": {
                    "type": "string",
                    "description": "The Kubernetes Deployment resource name.",
                    "minLength": 1
                }
            },
            "required": [
                "enabled",
                "name"
            ],
            "additionalProperties": false
        }
    },
    "required": [
        "build",
        "image"
    ],
    "additionalProperties": false
}